{
  "$schema": "https://wstein.github.io/cubacle/schema/v1/gen-definition.schema.json",
  "formatVersion": 1,
  "patternName": "concentric-squares",
  "patternTitle": "Concentric squares",
  "cubeSize": 5,
  "colorScheme": "western",
  "stickerGrid": [
    [
      ["a", "b", "b", "b", "a"],
      ["b", "b", "c", "b", "b"],
      ["b", "c", "U", "c", "b"],
      ["b", "b", "c", "b", "b"],
      ["a", "b", "b", "b", "a"]
    ]
  ],
  "colorConstraints": "unique(a*, b*, c*)"
}
